question,raw_answer,answer,short_answer,formated_answer
Anthony'nin 50 kalemi vardı. Kalemlerinin yarısını Brandon'a verdi ve kalan kalemlerin 3/5'ini Charlie'ye verdi. Geri kalan kalemleri kendisi tuttu. Anthony kaç kalem tuttu?,"Anthony başlangıçta 50 kaleme sahipti. Kalemlerinin yarısını, yani 50'nin yarısı olan 25'ini Brandon'a verdi. Geriye 50 - 25 = 25 kalem kaldı. Kalan kalemlerin 3/5'ini Charlie'ye verdiğinde, bu 25'in 3/5'i olan 15 kalem yapıyor. Anthony toplamda 25 + 15 = 40 kalem vermiş oldu. Dolayısıyla Anthony'nin kendisinde kalan kalem sayısı 50 - 40 = 10'dur. 
#### 10","Anthony başlangıçta 50 kaleme sahipti. Kalemlerinin yarısını, yani 50'nin yarısı olan 25'ini Brandon'a verdi. Geriye 50 - 25 = 25 kalem kaldı. Kalan kalemlerin 3/5'ini Charlie'ye verdiğinde, bu 25'in 3/5'i olan 15 kalem yapıyor. Anthony toplamda 25 + 15 = 40 kalem vermiş oldu. Dolayısıyla Anthony'nin kendisinde kalan kalem sayısı 50 - 40 = 10'dur.",10,"{'answer': ""Anthony başlangıçta 50 kaleme sahipti. Kalemlerinin yarısını, yani 50'nin yarısı olan 25'ini Brandon'a verdi. Geriye 50 - 25 = 25 kalem kaldı. Kalan kalemlerin 3/5'ini Charlie'ye verdiğinde, bu 25'in 3/5'i olan 15 kalem yapıyor. Anthony toplamda 25 + 15 = 40 kalem vermiş oldu. Dolayısıyla Anthony'nin kendisinde kalan kalem sayısı 50 - 40 = 10'dur."", 'short_answer': '10'}"
"Craig ve kardeşi bildikleri en uzun harfli kelimeleri sırayla heceliyor ve bu kelimelerdeki harf sayısını sayıyorlar. On tur sonunda, Craig her biri 15 harfli 20 kelime heceler. Eğer Craig'in kardeşi, Craig'den toplamda 50 harf fazla hecelenmiş kelimeler hecelerse, on tur sonunda heceledikleri kelimelerdeki toplam harf sayısını hesaplayın.","On tur sonunda, Craig bildiği en uzun harfli kelimelerden her biri 15 harfli olan 20 kelime heceler. Bu durumda Craig toplamda 20*15 = 300 harf hecelemiş olur.

Craig'in kardeşi ise Craig'den toplamda 50 harf fazla hecelemiştir. Bu durumda kardeşi 300+50 = 350 harf hecelemiş olur.

İki kardeşin heceledikleri kelimelerdeki toplam harf sayısı ise 350+300 = 650 harf olur.

#### 650","On tur sonunda, Craig bildiği en uzun harfli kelimelerden her biri 15 harfli olan 20 kelime heceler. Bu durumda Craig toplamda 20*15 = 300 harf hecelemiş olur.

Craig'in kardeşi ise Craig'den toplamda 50 harf fazla hecelemiştir. Bu durumda kardeşi 300+50 = 350 harf hecelemiş olur.

İki kardeşin heceledikleri kelimelerdeki toplam harf sayısı ise 350+300 = 650 harf olur.",650,"{'answer': ""On tur sonunda, Craig bildiği en uzun harfli kelimelerden her biri 15 harfli olan 20 kelime heceler. Bu durumda Craig toplamda 20*15 = 300 harf hecelemiş olur.\n\nCraig'in kardeşi ise Craig'den toplamda 50 harf fazla hecelemiştir. Bu durumda kardeşi 300+50 = 350 harf hecelemiş olur.\n\nİki kardeşin heceledikleri kelimelerdeki toplam harf sayısı ise 350+300 = 650 harf olur."", 'short_answer': '650'}"
"Dr. Wertz'in okulunda kız öğrencilerin sayısının iki katı kadar erkek öğrenci vardır. Eğer 60 kız öğrenci varsa ve her öğretmene düşen öğrenci sayısı 5 ise, okulda kaç öğretmen vardır?","Dr. Wertz'in okulunda kız öğrencilerin sayısı 60 olduğuna göre, erkek öğrenci sayısı bu sayının iki katıdır, yani 2*60 = 120 erkek öğrenci vardır. Toplam öğrenci sayısı kız ve erkek öğrencilerin toplamıdır, bu da 120 + 60 = 180 öğrenci demektir. Her öğretmene düşen öğrenci sayısı 5 olduğuna göre, 180 öğrenci için 180/5 = 36 öğretmene ihtiyaç vardır. Dolayısıyla okulda 36 öğretmen bulunmaktadır. #### 36","Dr. Wertz'in okulunda kız öğrencilerin sayısı 60 olduğuna göre, erkek öğrenci sayısı bu sayının iki katıdır, yani 2*60 = 120 erkek öğrenci vardır. Toplam öğrenci sayısı kız ve erkek öğrencilerin toplamıdır, bu da 120 + 60 = 180 öğrenci demektir. Her öğretmene düşen öğrenci sayısı 5 olduğuna göre, 180 öğrenci için 180/5 = 36 öğretmene ihtiyaç vardır. Dolayısıyla okulda 36 öğretmen bulunmaktadır.",36,"{'answer': ""Dr. Wertz'in okulunda kız öğrencilerin sayısı 60 olduğuna göre, erkek öğrenci sayısı bu sayının iki katıdır, yani 2*60 = 120 erkek öğrenci vardır. Toplam öğrenci sayısı kız ve erkek öğrencilerin toplamıdır, bu da 120 + 60 = 180 öğrenci demektir. Her öğretmene düşen öğrenci sayısı 5 olduğuna göre, 180 öğrenci için 180/5 = 36 öğretmene ihtiyaç vardır. Dolayısıyla okulda 36 öğretmen bulunmaktadır."", 'short_answer': '36'}"
"Ronnie'ye 5 dolar verilirken Rissa'ya üç katı kadar verildi. Her biri küçük kız kardeşlerine eşit miktarda para verdikten sonra, Rissa'nın parasının 4/5'i kalmıştır. Ronnie'nin parasında ne kadar kalmıştır?","Rissa'ya 5 doların 3 katı kadar, yani $5 x 3 = $15 verildi. Rissa küçük kız kardeşine bir miktar para verdikten sonra, parasının 4/5'i, yani $15 x 4/5 = $12'si kalmıştır. Bu, Rissa'nın kız kardeşine $15 - $12 = $3 verdiği anlamına gelir. Ronnie de Rissa ile aynı miktarda, yani $3 verdiğinden, Ronnie'nin elinde $5 - $3 = $2 kalmıştır.
#### 2","Rissa'ya 5 doların 3 katı kadar, yani $5 x 3 = $15 verildi. Rissa küçük kız kardeşine bir miktar para verdikten sonra, parasının 4/5'i, yani $15 x 4/5 = $12'si kalmıştır. Bu, Rissa'nın kız kardeşine $15 - $12 = $3 verdiği anlamına gelir. Ronnie de Rissa ile aynı miktarda, yani $3 verdiğinden, Ronnie'nin elinde $5 - $3 = $2 kalmıştır.",2,"{'answer': ""Rissa'ya 5 doların 3 katı kadar, yani $5 x 3 = $15 verildi. Rissa küçük kız kardeşine bir miktar para verdikten sonra, parasının 4/5'i, yani $15 x 4/5 = $12'si kalmıştır. Bu, Rissa'nın kız kardeşine $15 - $12 = $3 verdiği anlamına gelir. Ronnie de Rissa ile aynı miktarda, yani $3 verdiğinden, Ronnie'nin elinde $5 - $3 = $2 kalmıştır."", 'short_answer': '2'}"
"Carver yeni 45 yaşına girdi, bu da onun yaşının iki katından 5 yaş eksik olduğunu gösteriyor. Oğlu kaç yaşında?","Carver'ın yaşı 45 olduğuna göre ve bu da onun oğlunun yaşının iki katından 5 yaş eksik olduğunu gösteriyorsa, denklemi kurabiliriz: 45 = (2 * x) - 5. Burada x, Carver'ın oğlunun yaşını temsil eder. Denkleme 5 ekleyerek her iki tarafı da dengeleyelim: 45 + 5 = (2 * x). Bu da 50 = 2 * x olur. Buradan x'i yalnız bırakmak için her iki tarafı da 2'ye bölelim: x = 50 / 2. Sonuç olarak, Carver'ın oğlunun yaşı x = 25 yaşındadır.
#### 25","Carver'ın yaşı 45 olduğuna göre ve bu da onun oğlunun yaşının iki katından 5 yaş eksik olduğunu gösteriyorsa, denklemi kurabiliriz: 45 = (2 * x) - 5. Burada x, Carver'ın oğlunun yaşını temsil eder. Denkleme 5 ekleyerek her iki tarafı da dengeleyelim: 45 + 5 = (2 * x). Bu da 50 = 2 * x olur. Buradan x'i yalnız bırakmak için her iki tarafı da 2'ye bölelim: x = 50 / 2. Sonuç olarak, Carver'ın oğlunun yaşı x = 25 yaşındadır.",25,"{'answer': ""Carver'ın yaşı 45 olduğuna göre ve bu da onun oğlunun yaşının iki katından 5 yaş eksik olduğunu gösteriyorsa, denklemi kurabiliriz: 45 = (2 * x) - 5. Burada x, Carver'ın oğlunun yaşını temsil eder. Denkleme 5 ekleyerek her iki tarafı da dengeleyelim: 45 + 5 = (2 * x). Bu da 50 = 2 * x olur. Buradan x'i yalnız bırakmak için her iki tarafı da 2'ye bölelim: x = 50 / 2. Sonuç olarak, Carver'ın oğlunun yaşı x = 25 yaşındadır."", 'short_answer': '25'}"
