ind,activity_label,ctx_a,ctx_b,ctx,endings,source_id,split,split_type,label,question,answer,answerKey
29870,İlişkiler,"[header] Bir erkeği 10 gün içinde kaybetmekten nasıl kaçınılır? [title] Kıskanmayın. [adım] Kızlar, size güvenmemeniz için bir neden verene kadar erkeğinize güvenmelisiniz. Kıskanç bir kız arkadaştan daha sinir bozucu bir şey yoktur.",,"[header] Bir erkeği 10 gün içinde kaybetmekten nasıl kaçınılır? [title] Kıskanmayın. [adım] Kızlar, size güvenmemeniz için bir neden verene kadar erkeğinize güvenmelisiniz. Kıskanç bir kız arkadaştan daha sinir bozucu bir şey yoktur.","['Kız arkadaşları olmasına izin veriliyor, eski bir deyişte olduğu gibi ""Bakabilirsin ama dokunma."" Aynı şey senin için de geçerli. Telefonuna bakmanıza, tüm mesajlarını okumanıza veya gittiği her yerde onu takip etmenize gerek yok.'
 'Ancak size seks yapmamanız için bir neden verecek cesareti varsa, o zaman bunun bir önemi yoktur. Eğer bunu yapmazsa aslında söylenecek bir şey yok.'
 'Bazen erkekler o kadar gergin olurlar ki farkına bile varmazlar ve çok çabuk heyecanlanırlar. Eğer risk alacak ve ona aşık olacak cesaretiniz varsa, o zaman 10 gün içinde kendinize gelmeniz neredeyse garantidir.'
 '[title] Bilin ki onun ""bir kızın geçmişi olsaydı birlikte ne yapabileceğinizi düşünüyorsunuz? [adım]!"" gibi bir şey söylediğini duyarsanız, bunu bir güven işareti olarak almalısınız.']",wikihow~49238,train,indomain,0,"[header] Bir erkeği 10 gün içinde kaybetmekten nasıl kaçınılır? [title] Kıskanmayın. [adım] Kızlar, size güvenmemeniz için bir neden verene kadar erkeğinize güvenmelisiniz. Kıskanç bir kız arkadaştan daha sinir bozucu bir şey yoktur.
Şıklar:
A- Kız arkadaşları olmasına izin veriliyor, eski bir deyişte olduğu gibi ""Bakabilirsin ama dokunma."" Aynı şey senin için de geçerli. Telefonuna bakmanıza, tüm mesajlarını okumanıza veya gittiği her yerde onu takip etmenize gerek yok.
B- Ancak size seks yapmamanız için bir neden verecek cesareti varsa, o zaman bunun bir önemi yoktur. Eğer bunu yapmazsa aslında söylenecek bir şey yok.
C- Bazen erkekler o kadar gergin olurlar ki farkına bile varmazlar ve çok çabuk heyecanlanırlar. Eğer risk alacak ve ona aşık olacak cesaretiniz varsa, o zaman 10 gün içinde kendinize gelmeniz neredeyse garantidir.
D- [title] Bilin ki onun ""bir kızın geçmişi olsaydı birlikte ne yapabileceğinizi düşünüyorsunuz? [adım]!"" gibi bir şey söylediğini duyarsanız, bunu bir güven işareti olarak almalısınız.","Kız arkadaşları olmasına izin veriliyor, eski bir deyişte olduğu gibi ""Bakabilirsin ama dokunma."" Aynı şey senin için de geçerli. Telefonuna bakmanıza, tüm mesajlarını okumanıza veya gittiği her yerde onu takip etmenize gerek yok.",A
25405,İlişkiler,[header] Bir ilişkideki duygusal dağınıklığı nasıl temizleyebilirsiniz? [title] Diğer kişiyle ilgili hislerinize uyum sağlayın. [adım] Kendinize ilişkide sizi gerçekten neyin rahatsız ettiğini sorun. Rahatsız edici veya yüzleşmesi zor olsa bile duygularınızı kabul edin.,,[header] Bir ilişkideki duygusal dağınıklığı nasıl temizleyebilirsiniz? [title] Diğer kişiyle ilgili hislerinize uyum sağlayın. [adım] Kendinize ilişkide sizi gerçekten neyin rahatsız ettiğini sorun. Rahatsız edici veya yüzleşmesi zor olsa bile duygularınızı kabul edin.,"['Kendinize yalnız olduğunuzu ve rahatsız olmanızı gerektirecek hiçbir şey olmadığını hatırlatın. [alt adımlar] Bir ilişkiye duygusal olarak dahil olmanın anahtarı, başka bir kişiden kırgınlık veya incinme duygularını kalıcı olarak ortadan kaldırmanın imkansız olduğunu kabul etmektir.'
 'İçinizden hangi duyguların geçtiğine dikkat edin. Bazıları ile baş etmek diğerlerinden daha zordur, ancak bazıları değildir.'
 '[alt adımlar] Olumsuz duygularınızı bastırmaktan veya bunların kendiliğinden geçeceğini ummaktan kaçının. Fiziksel dağınıklık gibi, duygusal yük de siz ondan kurtulmak için harekete geçmediğiniz sürece kaybolmaz.'
 'Tavsiyede bulunmadan veya teşvik etmeden kendi duygularınızı diğer kişininkiyle karşılaştırın. [title] Diğer kişiye değil, her iki tarafın eylemlerine bakın.']",wikihow~41873,train,indomain,2,"[header] Bir ilişkideki duygusal dağınıklığı nasıl temizleyebilirsiniz? [title] Diğer kişiyle ilgili hislerinize uyum sağlayın. [adım] Kendinize ilişkide sizi gerçekten neyin rahatsız ettiğini sorun. Rahatsız edici veya yüzleşmesi zor olsa bile duygularınızı kabul edin.
Şıklar:
A- Kendinize yalnız olduğunuzu ve rahatsız olmanızı gerektirecek hiçbir şey olmadığını hatırlatın. [alt adımlar] Bir ilişkiye duygusal olarak dahil olmanın anahtarı, başka bir kişiden kırgınlık veya incinme duygularını kalıcı olarak ortadan kaldırmanın imkansız olduğunu kabul etmektir.
B- İçinizden hangi duyguların geçtiğine dikkat edin. Bazıları ile baş etmek diğerlerinden daha zordur, ancak bazıları değildir.
C- [alt adımlar] Olumsuz duygularınızı bastırmaktan veya bunların kendiliğinden geçeceğini ummaktan kaçının. Fiziksel dağınıklık gibi, duygusal yük de siz ondan kurtulmak için harekete geçmediğiniz sürece kaybolmaz.
D- Tavsiyede bulunmadan veya teşvik etmeden kendi duygularınızı diğer kişininkiyle karşılaştırın. [title] Diğer kişiye değil, her iki tarafın eylemlerine bakın.","[alt adımlar] Olumsuz duygularınızı bastırmaktan veya bunların kendiliğinden geçeceğini ummaktan kaçının. Fiziksel dağınıklık gibi, duygusal yük de siz ondan kurtulmak için harekete geçmediğiniz sürece kaybolmaz.",C
12283,Kano sporu,"Suda kask takan, elinde kürek tutan ve kanoda oturan bir adam gösteriliyor.",o,"Suda kask takan, elinde kürek tutan ve kanoda oturan bir adam gösteriliyor. O","['kanonun nasıl kullanılacağı hakkında kameraya konuşuyor.'
 'Kayalık suların üzerinde kürek çekiyor, en sonunda suya giriyor.'
 'daha sonra su kayağının nasıl yapıldığını nasıl anlattığını gösteriyor.'
 'kendini teknenin yanından yüzeye doğru çekiyor, sonra nehrin aşağısına doğru.']",activitynet~v_QnATCZ_P9DE,train,indomain,0,"Suda kask takan, elinde kürek tutan ve kanoda oturan bir adam gösteriliyor. O
Şıklar:
A- kanonun nasıl kullanılacağı hakkında kameraya konuşuyor.
B- Kayalık suların üzerinde kürek çekiyor, en sonunda suya giriyor.
C- daha sonra su kayağının nasıl yapıldığını nasıl anlattığını gösteriyor.
D- kendini teknenin yanından yüzeye doğru çekiyor, sonra nehrin aşağısına doğru.",kanonun nasıl kullanılacağı hakkında kameraya konuşuyor.,A
39508,Finans ve İşletme,"[header] Zorunlu bir dilekçe nasıl sunulur [title] Diğer tarafla görüşün. [adım] Federal mahkemede kural 37, mahkemeden yardım istemeden önce diğer taraftan bilgi almak için ""iyi niyetle"" çaba göstermenizi gerektirir. Pek çok eyalet, bilgileri diğer taraftan gayri resmi olarak almaya çalışmanızı da gerektirir.",,"[header] Zorunlu bir dilekçe nasıl sunulur [title] Diğer tarafla görüşün. [adım] Federal mahkemede kural 37, mahkemeden yardım istemeden önce diğer taraftan bilgi almak için ""iyi niyetle"" çaba göstermenizi gerektirir. Pek çok eyalet, bilgileri diğer taraftan gayri resmi olarak almaya çalışmanızı da gerektirir.","['[alt adımlar] Eyaletinizin hukuk muhakemesi kurallarını bulun. Eyaletiniz için hukuk muhakemesi kurallarını bulmak için bir internet arama motoru bulunmalıdır.'
 'Bu nedenle önergenizi vermeden önce iletişime geçmelisiniz. [alt adımlar] İdeal olarak bir mektup göndermelisiniz.'
 'Zorlama hareketine başladığınızda tartışmanın her iki tarafıyla da konuşmak en kolayı olabilir. [title] Karşı tarafın önergeyi destekleyecek herhangi bir bilgisi olup olmadığını öğrenin.'
 '[alt adımlar] Aleyhinizdeki davanın gerçeklerini ortaya koyan "" standart "" bir önergede ısrar etmelisiniz. Standart önerge, karşı tarafın direnci artırmadan zorlamak için neyi kanıtlaması gerektiğini açıklamalıdır.']",wikihow~65031,train,indomain,1,"[header] Zorunlu bir dilekçe nasıl sunulur [title] Diğer tarafla görüşün. [adım] Federal mahkemede kural 37, mahkemeden yardım istemeden önce diğer taraftan bilgi almak için ""iyi niyetle"" çaba göstermenizi gerektirir. Pek çok eyalet, bilgileri diğer taraftan gayri resmi olarak almaya çalışmanızı da gerektirir.
Şıklar:
A- [alt adımlar] Eyaletinizin hukuk muhakemesi kurallarını bulun. Eyaletiniz için hukuk muhakemesi kurallarını bulmak için bir internet arama motoru bulunmalıdır.
B- Bu nedenle önergenizi vermeden önce iletişime geçmelisiniz. [alt adımlar] İdeal olarak bir mektup göndermelisiniz.
C- Zorlama hareketine başladığınızda tartışmanın her iki tarafıyla da konuşmak en kolayı olabilir. [title] Karşı tarafın önergeyi destekleyecek herhangi bir bilgisi olup olmadığını öğrenin.
D- [alt adımlar] Aleyhinizdeki davanın gerçeklerini ortaya koyan "" standart "" bir önergede ısrar etmelisiniz. Standart önerge, karşı tarafın direnci artırmadan zorlamak için neyi kanıtlaması gerektiğini açıklamalıdır.",Bu nedenle önergenizi vermeden önce iletişime geçmelisiniz. [alt adımlar] İdeal olarak bir mektup göndermelisiniz.,B
46795,Gitar çalıyorum,Bir adam oturmuş sigara içiyor. Beyaz bir gitar tutuyor ve çalıyor.,o,Bir adam oturmuş sigara içiyor. Beyaz bir gitar tutuyor ve çalıyor. O,"['ağzından dumanı üflemeye devam ediyor.'
 'sigarayı cebine atar ve gitar çalmaya devam eder.'
 'duraklar ve başını eğerek oynamaya devam eder.'
 'mikrofona şarkı söylemeye başlar.']",activitynet~v_a8dUtKcAunw,train,indomain,3,"Bir adam oturmuş sigara içiyor. Beyaz bir gitar tutuyor ve çalıyor. O
Şıklar:
A- ağzından dumanı üflemeye devam ediyor.
B- sigarayı cebine atar ve gitar çalmaya devam eder.
C- duraklar ve başını eğerek oynamaya devam eder.
D- mikrofona şarkı söylemeye başlar.",mikrofona şarkı söylemeye başlar.,D
