id,question,choices,answerKey,answer
Mercury_7215740,"Bilim insanları bir enfeksiyonun nedenini belirlemek için bir hayvanın hücrelerini analiz etti. Bilim adamları analizin sonuçları konusunda hemfikir değildi. Bu anlaşmazlık bilimin doğası hakkında neye işaret ediyor?
Şıklar:
A. Bilim insanları verileri farklı formatlarda sunabilirler.
B. Bilimsel sonuçlar farklı şekillerde yorumlanabilir.
C. Bilim adamları desteklenmeyen iddialarda bulunabilirler.
D. Bilimsel sonuçlar çoğu zaman beklenen sonuçlardan farklıdır.","{'text': ['Bilim insanları verileri farklı formatlarda sunabilirler.', 'Bilimsel sonuçlar farklı şekillerde yorumlanabilir.', 'Bilim adamları desteklenmeyen iddialarda bulunabilirler.', 'Bilimsel sonuçlar çoğu zaman beklenen sonuçlardan farklıdır.'], 'label': ['A', 'B', 'C', 'D']}",B,Bilimsel sonuçlar farklı şekillerde yorumlanabilir.
MCAS_2008_8_5608,"Yeni bir organizma keşfedilirse, onu uygun krallığa sınıflandırmak için aşağıdakilerden hangisi büyük olasılıkla kullanılır?
Şıklar:
A. organizmanın rengi
B. organizmanın doğal yaşam alanı
C. organizmanın anatomisinin yapısı
D. organizmanın bulunduğu yer","{'text': ['organizmanın rengi', 'organizmanın doğal yaşam alanı', 'organizmanın anatomisinin yapısı', 'organizmanın bulunduğu yer'], 'label': ['A', 'B', 'C', 'D']}",C,organizmanın anatomisinin yapısı
Mercury_SC_400700,"Hangi gerçek neden Dünya'da hayat olduğunu ama Ay'da olmadığını en iyi açıklıyor?
Şıklar:
A. Ay'ın yerçekimi yoktur.
B. Ay Güneş'in etrafında dönmez.
C. Ay'da çok az su ve oksijen vardır.
D. Ay Dünya'dan çok daha küçüktür.","{'text': [""Ay'ın yerçekimi yoktur."", ""Ay Güneş'in etrafında dönmez."", ""Ay'da çok az su ve oksijen vardır."", ""Ay Dünya'dan çok daha küçüktür.""], 'label': ['A', 'B', 'C', 'D']}",C,Ay'da çok az su ve oksijen vardır.
NYSEDREGENTS_2007_8_23,"Doğrudan güneş ışığına maruz bırakıldığında hangi nesne en görünür ışık enerjisini emer?
Şıklar:
1. bir parça şeffaf cam
2. bir kartopu
3. parlak bir ayna
4. siyah bir kazak","{'text': ['bir parça şeffaf cam', 'bir kartopu', 'parlak bir ayna', 'siyah bir kazak'], 'label': ['1', '2', '3', '4']}",4,siyah bir kazak
Mercury_SC_416529,"Neden orman ağaçlarının yapraklarının çoğu ağacın tepesinde yetişiyor?
Şıklar:
A. tohumları dağıtmak
B. güneş ışığını yakalamak için
C. bagajı gölgelemek
D. su toplamak","{'text': ['tohumları dağıtmak', 'güneş ışığını yakalamak için', 'bagajı gölgelemek', 'su toplamak'], 'label': ['A', 'B', 'C', 'D']}",B,güneş ışığını yakalamak için
